<?xml version="1.0" encoding="UTF-8" standalone="no"?><list xmlns:ns0="http://www.w3.org/2001/XMLSchema-instance" allowAugmentedItems="true" allowElementalItems="true" keepEnchant="true" ns0:noNamespaceSchemaLocation="../../../../xsd/multisell.xsd" showAll="true" taxFree="true">
	<item>
		
		<ingredient count="1" id="9416"/>
		
		<ingredient count="1" id="9451"/>
		
		<production count="1" id="9417"/>
	</item>
	<item>
		
		<ingredient count="1" id="9416"/>
		
		<ingredient count="1" id="9451"/>
		
		<production count="1" id="9418"/>
	</item>
	<item>
		
		<ingredient count="1" id="9416"/>
		
		<ingredient count="1" id="9451"/>
		
		<production count="1" id="9419"/>
	</item>
	<item>
		
		<ingredient count="1" id="9416"/>
		
		<ingredient count="1" id="9451"/>
		
		<production count="1" id="9420"/>
	</item>
	<item>
		
		<ingredient count="1" id="9416"/>
		
		<ingredient count="1" id="10413"/>
		
		<production count="1" id="10228"/>
	</item>
	<item>
		
		<ingredient count="1" id="9416"/>
		
		<ingredient count="1" id="10413"/>
		
		<production count="1" id="10229"/>
	</item>
	<item>
		
		<ingredient count="1" id="9416"/>
		
		<ingredient count="1" id="10413"/>
		
		<production count="1" id="10230"/>
	</item>
	<item>
		
		<ingredient count="1" id="9416"/>
		
		<ingredient count="1" id="10413"/>
		
		<production count="1" id="10231"/>
	</item>
	<item>
		
		<ingredient count="1" id="9425"/>
		
		<ingredient count="1" id="9451"/>
		
		<production count="1" id="9426"/>
	</item>
	<item>
		
		<ingredient count="1" id="9425"/>
		
		<ingredient count="1" id="9451"/>
		
		<production count="1" id="9427"/>
	</item>
	<item>
		
		<ingredient count="1" id="9425"/>
		
		<ingredient count="1" id="9451"/>
		
		<production count="1" id="10126"/>
	</item>
	<item>
		
		<ingredient count="1" id="9425"/>
		
		<ingredient count="1" id="9451"/>
		
		<production count="1" id="10127"/>
	</item>
	<item>
		
		<ingredient count="1" id="9425"/>
		
		<ingredient count="1" id="9451"/>
		
		<production count="1" id="10168"/>
	</item>
	<item>
		
		<ingredient count="1" id="9425"/>
		
		<ingredient count="1" id="9451"/>
		
		<production count="1" id="10214"/>
	</item>
	<item>
		
		<ingredient count="1" id="9425"/>
		
		<ingredient count="1" id="10413"/>
		
		<production count="1" id="10233"/>
	</item>
	<item>
		
		<ingredient count="1" id="9425"/>
		
		<ingredient count="1" id="10413"/>
		
		<production count="1" id="10234"/>
	</item>
	<item>
		
		<ingredient count="1" id="9425"/>
		
		<ingredient count="1" id="10413"/>
		
		<production count="1" id="10487"/>
	</item>
	<item>
		
		<ingredient count="1" id="9425"/>
		
		<ingredient count="1" id="10413"/>
		
		<production count="1" id="10488"/>
	</item>
	<item>
		
		<ingredient count="1" id="9425"/>
		
		<ingredient count="1" id="10413"/>
		
		<production count="1" id="10489"/>
	</item>
	<item>
		
		<ingredient count="1" id="9425"/>
		
		<ingredient count="1" id="10413"/>
		
		<production count="1" id="10490"/>
	</item>
	<item>
		
		<ingredient count="1" id="9432"/>
		
		<ingredient count="1" id="9451"/>
		
		<production count="1" id="9433"/>
	</item>
	<item>
		
		<ingredient count="1" id="9432"/>
		
		<ingredient count="1" id="9451"/>
		
		<production count="1" id="9434"/>
	</item>
	<item>
		
		<ingredient count="1" id="9432"/>
		
		<ingredient count="1" id="9451"/>
		
		<production count="1" id="9435"/>
	</item>
	<item>
		
		<ingredient count="1" id="9432"/>
		
		<ingredient count="1" id="9451"/>
		
		<production count="1" id="9436"/>
	</item>
	<item>
		
		<ingredient count="1" id="9432"/>
		
		<ingredient count="1" id="10413"/>
		
		<production count="1" id="10236"/>
	</item>
	<item>
		
		<ingredient count="1" id="9432"/>
		
		<ingredient count="1" id="10413"/>
		
		<production count="1" id="10237"/>
	</item>
	<item>
		
		<ingredient count="1" id="9432"/>
		
		<ingredient count="1" id="10413"/>
		
		<production count="1" id="10238"/>
	</item>
	<item>
		
		<ingredient count="1" id="9432"/>
		
		<ingredient count="1" id="10413"/>
		
		<production count="1" id="10239"/>
	</item>
</list>