<?xml version="1.0" encoding="utf-8"?>
<list xmlns:ns0="http://www.w3.org/2001/XMLSchema-instance" taxFree="true" showAll="true" keepEnchant="false" allowAugmentedItems="false"
	  allowElementalItems="false" npcCheck="false"
	  ns0:noNamespaceSchemaLocation="../../../../../xsd/multisell.xsd">
	<item>
		<!-- Адена -->
		<ingredient id="57" count="120000000"/>
		<!-- Острие Реквиема -->
		<production id="17290" count="1"/>
	</item>
	<item>
		<!-- Адена -->
		<ingredient id="57" count="120000000"/>
		<!-- Резак Реквиема -->
		<production id="17291" count="1"/>
	</item>
	<item>
		<!-- Адена -->
		<ingredient id="57" count="120000000"/>
		<!-- Эспадон Реквиема -->
		<production id="17292" count="1"/>
	</item>
	<item>
		<!-- Адена -->
		<ingredient id="57" count="120000000"/>
		<!-- Мститель Реквиема -->
		<production id="17293" count="1"/>
	</item>
	<item>
		<!-- Адена -->
		<ingredient id="57" count="120000000"/>
		<!-- Воитель Реквиема -->
		<production id="17294" count="1"/>
	</item>
	<item>
		<!-- Адена -->
		<ingredient id="57" count="120000000"/>
		<!-- Буревестник Реквиема -->
		<production id="17295" count="1"/>
	</item>
	<item>
		<!-- Адена -->
		<ingredient id="57" count="120000000"/>
		<!-- Бросок Реквиема -->
		<production id="17296" count="1"/>
	</item>
	<item>
		<!-- Адена -->
		<ingredient id="57" count="120000000"/>
		<!-- Страж Реквиема -->
		<production id="17297" count="1"/>
	</item>
	<item>
		<!-- Адена -->
		<ingredient id="57" count="120000000"/>
		<!-- Расчленитель Реквиема -->
		<production id="17298" count="1"/>
	</item>
	<item>
		<!-- Адена -->
		<ingredient id="57" count="120000000"/>
		<!-- Заклинатель Реквиема -->
		<production id="17299" count="1"/>
	</item>
	<item>
		<!-- Адена -->
		<ingredient id="57" count="120000000"/>
		<!-- Возмездие Реквиема -->
		<production id="17300" count="1"/>
	</item>
	<item>
		<!-- Адена -->
		<ingredient id="57" count="120000000"/>
		<!-- Парные Мечи Реквиема -->
		<production id="17301" count="1"/>
	</item>
	<item>
		<!-- Адена -->
		<ingredient id="57" count="120000000"/>
		<!-- Парные Кинжалы Реквиема -->
		<production id="17302" count="1"/>
	</item>
	<item>
		<!-- Адена -->
		<ingredient id="57" count="120000000"/>
		<!-- Парные Дубины Реквиема -->
		<production id="17303" count="1"/>
	</item>
	<item>
		<!-- Адена -->
		<ingredient id="57" count="150000000"/>
		<!-- Острие Апокалипсиса -->
		<production id="17324" count="1"/>
	</item>
	<item>
		<!-- Адена -->
		<ingredient id="57" count="150000000"/>
		<!-- Резак Апокалипсиса -->
		<production id="17325" count="1"/>
	</item>
	<item>
		<!-- Адена -->
		<ingredient id="57" count="150000000"/>
		<!-- Эспадон Апокалипсиса -->
		<production id="17326" count="1"/>
	</item>
	<item>
		<!-- Адена -->
		<ingredient id="57" count="150000000"/>
		<!-- Мститель Апокалипсиса -->
		<production id="17327" count="1"/>
	</item>
	<item>
		<!-- Адена -->
		<ingredient id="57" count="150000000"/>
		<!-- Воитель Апокалипсиса -->
		<production id="17328" count="1"/>
	</item>
	<item>
		<!-- Адена -->
		<ingredient id="57" count="150000000"/>
		<!-- Буревестник Апокалипсиса -->
		<production id="17329" count="1"/>
	</item>
	<item>
		<!-- Адена -->
		<ingredient id="57" count="150000000"/>
		<!-- Бросок Апокалипсиса -->
		<production id="17330" count="1"/>
	</item>
	<item>
		<!-- Адена -->
		<ingredient id="57" count="150000000"/>
		<!-- Страж Апокалипсиса -->
		<production id="17331" count="1"/>
	</item>
	<item>
		<!-- Адена -->
		<ingredient id="57" count="150000000"/>
		<!-- Расчленитель Апокалипсиса -->
		<production id="17332" count="1"/>
	</item>
	<item>
		<!-- Адена -->
		<ingredient id="57" count="150000000"/>
		<!-- Заклинатель Апокалипсиса -->
		<production id="17333" count="1"/>
	</item>
	<item>
		<!-- Адена -->
		<ingredient id="57" count="150000000"/>
		<!-- Возмездие Апокалипсиса -->
		<production id="17334" count="1"/>
	</item>
	<item>
		<!-- Адена -->
		<ingredient id="57" count="150000000"/>
		<!-- Парные Мечи Апокалипсиса -->
		<production id="17335" count="1"/>
	</item>
	<item>
		<!-- Адена -->
		<ingredient id="57" count="150000000"/>
		<!-- Парные Кинжалы Апокалипсиса -->
		<production id="17336" count="1"/>
	</item>
	<item>
		<!-- Адена -->
		<ingredient id="57" count="150000000"/>
		<!-- Парные Дубины Апокалипсиса -->
		<production id="17337" count="1"/>
	</item>
</list>
