<?xml version="1.0" encoding="UTF-8" standalone="no"?><list xmlns:ns0="http://www.w3.org/2001/XMLSchema-instance" allowAugmentedItems="false" allowElementalItems="false" keepEnchant="false" ns0:noNamespaceSchemaLocation="../../../../xsd/multisell.xsd" showAll="true" taxFree="true">

	<item>
		<ingredient count="3997000" id="57"/>		
		<production count="1" id="36187"/>		
	</item>
	<item>
		<ingredient count="11941000" id="57"/>		
		<production count="1" id="36188"/>		
	</item>
	<item>
		<ingredient count="1999000" id="57"/>		
		<production count="1" id="36189"/>		
	</item>
	<item>
		<ingredient count="5970000" id="57"/>		
		<production count="1" id="36190"/>		
	</item>
</list>